{
  "schemaVersion": 1,
  "profile": "strict-node",
  "ci": {
    "requiredChecks": [
      "Security audit",
      "Lint",
      "Tests & ratchet",
      "Docker image gate"
    ],
    "advisoryChecks": [
      "SonarCloud",
      "SonarCloud Code Analysis"
    ],
    "coverageRatchet": true,
    "maxFileLines": 300,
    "diffCoverage": {
      "enabled": true,
      "minPercentage": 90,
      "blockOnFailure": true
    }
  },
  "bootstrap": {
    "license": {
      "enabled": true,
      "type": "MIT"
    },
    "funding": {
      "enabled": true,
      "buyMeACoffee": "ricardo230a"
    },
    "dependabot": {
      "enabled": true
    },
    "readme": {
      "enabled": true,
      "style": "devandreotti"
    }
  },
  "github": {
    "copilotReview": true,
    "branchProtection": true,
    "requireConversationResolution": true
  },
  "dockerImageDoctor": {
    "enabled": "auto",
    "runWhen": "docker-files-present",
    "scriptPath": "D:\\Dev\\Scripts\\seguranca\\18-Docker-Image-Doctor.ps1",
    "agentArgs": [
      "-Preset",
      "AI",
      "-ForAI",
      "-Json",
      "-FixPlan",
      "-NoPrompt"
    ],
    "interactiveAllowed": false,
    "blockOn": [
      "Critical"
    ],
    "warnOn": [
      "High",
      "Medium"
    ],
    "fallbackWhenUnavailable": "static-advisory"
  },
  "localValidation": {
    "untrackedAllowlist": [
      "samples/**"
    ],
    "pytestBasetempPattern": ".pytest-tmp-qg-${timestamp}-${pid}"
  }
}
